{
    "meta": {
        "protocol_version": "1.0.0",
        "schema_version": "1.0.0",
        "created_at": "2025-01-01T00:00:00.000Z"
    },
    "confirm_id": "550e8400-e29b-41d4-a716-446655440000",
    "target_type": "context",
    "target_id": "550e8400-e29b-41d4-a716-446655440001",
    "status": "pending",
    "requested_by_role": "agent",
    "requested_at": "2025-01-01T00:00:00.000Z",
    "events": [
        {
            "event_id": "550e8400-e29b-41d4-a716-446655440200",
            "event_type": "confirm.requested",
            "source": "confirm",
            "timestamp": "2025-01-01T00:00:00.000Z"
        }
    ]
}